post_id,subreddit,author,timestamp,type,domain,title,score,comments_count,link,comments
thing_t3_r6fkj9,SocialJusticeInAction,WokePokeBowl,1638367754000,video,youtube.com,"46 seconds is all it takes to prove dystopian levels of media disinformation. ""He was marching with the band at the Christmas parade when he was injured. He broke his leg.""",113,51,https://www.youtube.com/watch?v=O3wUlUySXiM,https://old.reddit.com/r/SocialJusticeInAction/comments/r6fkj9/46_seconds_is_all_it_takes_to_prove_dystopian/
thing_t3_r6mnan,tucker_carlson,WokePokeBowl,1638386219000,link,cnn.com,First confirmed US case of Omicron coronavirus detected in fully vaccinated Californian. THAT👏MEANS👏IT'S👏WORKING👏,19,3,https://www.cnn.com/2021/12/01/health/us-omicron-variant-confirmed-case/index.html,https://old.reddit.com/r/tucker_carlson/comments/r6mnan/first_confirmed_us_case_of_omicron_coronavirus/
thing_t3_r6fhv5,propaganda,WokePokeBowl,1638367534000,video,youtube.com,"46 seconds to prove flagrant media disinformation. Not misinformation, disinformation. ""He broke his leg while walking in a parade.""",13,7,https://www.youtube.com/watch?v=O3wUlUySXiM,https://old.reddit.com/r/propaganda/comments/r6fhv5/46_seconds_to_prove_flagrant_media_disinformation/
thing_t3_r5oqpp,SocialJusticeInAction,WokePokeBowl,1638283371000,video,youtube.com,SNL implies the Rittenhouse trial wasn't legitimate and race based. Unironically claims Rittenhouse had an AK-47.,63,13,https://www.youtube.com/watch?v=s9wdy9W4-LQ,https://old.reddit.com/r/SocialJusticeInAction/comments/r5oqpp/snl_implies_the_rittenhouse_trial_wasnt/
thing_t3_r0hkms,Chase,WokePokeBowl,1637686417000,text,,Chase removed travel notices: Clown Town,6,5,,https://old.reddit.com/r/Chase/comments/r0hkms/chase_removed_travel_notices_clown_town/
thing_t3_qxk1ol,TheBidenshitshow,WokePokeBowl,1637339971000,link,yahoo.com,"Justice Department charges 2 Iranians who pretended to be Proud Boys, sent Republican officials a fake ballot fraud video, and threatened tens of thousands of Democratic voters. I wonder if the $1.7 billion Democrat cash payment to Iran helped finance such an operation.",46,1,https://www.yahoo.com/entertainment/justice-department-charges-2-iranians-210552849.html,https://old.reddit.com/r/TheBidenshitshow/comments/qxk1ol/justice_department_charges_2_iranians_who/
thing_t3_qlbusw,TheBidenshitshow,WokePokeBowl,1635880670000,image,i.imgur.com,"I can't imagine why the Chinese Communist Party targeted Eric Swalwell, obvious genius, as an intelligence asset.",437,78,https://i.imgur.com/w0IxZcy.jpg,https://old.reddit.com/r/TheBidenshitshow/comments/qlbusw/i_cant_imagine_why_the_chinese_communist_party/
thing_t3_ql5d7r,tucker_carlson,WokePokeBowl,1635863111000,image,i.imgur.com,"""Vote, or else!"" I'm sure Democrats will investigate this voter intimidation being pushed by SMS to VA phone numbers.",14,2,https://i.imgur.com/eKe1ptq.png,https://old.reddit.com/r/tucker_carlson/comments/ql5d7r/vote_or_else_im_sure_democrats_will_investigate/
thing_t3_qlamko,tucker_carlson,WokePokeBowl,1635877369000,video,youtube.com,Coca-Cola is our Strength,5,3,https://www.youtube.com/watch?v=hqnUohxXV0I,https://old.reddit.com/r/tucker_carlson/comments/qlamko/cocacola_is_our_strength/
thing_t3_qhuzui,tucker_carlson,WokePokeBowl,1635450457000,link,wsj.com,"🤡🤡🤡🤡🤡 Biden Admin in Talks to Pay Illegal Immigrants ~$450,000 PER PERSON in Compensation if Family Separated After Illegally Crossing 🤡🤡🤡🤡🤡",270,62,https://www.wsj.com/articles/biden-administration-in-talks-to-pay-hundreds-of-millions-to-immigrant-families-separated-at-border-11635447591,https://old.reddit.com/r/tucker_carlson/comments/qhuzui/biden_admin_in_talks_to_pay_illegal_immigrants/
thing_t3_qhnjw9,EnoughCommieSpam,WokePokeBowl,1635429172000,link,archive.md,Commie on r/PoliticalHumor confidently leveling death threats at another. Upvoted.,19,0,https://archive.md/qWsqq,https://old.reddit.com/r/EnoughCommieSpam/comments/qhnjw9/commie_on_rpoliticalhumor_confidently_leveling/
thing_t3_qhv1tu,tucker_carlson,WokePokeBowl,1635450616000,link,zerohedge.com,Rutgers Professor: Kill White People,1,1,https://www.zerohedge.com/geopolitical/rutgers-professor-white-people-we-gotta-take-these-mfers-out,https://old.reddit.com/r/tucker_carlson/comments/qhv1tu/rutgers_professor_kill_white_people/
thing_t3_qbibkw,NoahGetTheBoat,WokePokeBowl,1634670078000,link,nypost.com,Passengers held up phones during rape of woman on Philadelphia commuter train,33,4,https://nypost.com/2021/10/19/passengers-held-up-phones-during-philadelphia-septa-rape/,https://old.reddit.com/r/NoahGetTheBoat/comments/qbibkw/passengers_held_up_phones_during_rape_of_woman_on/
thing_t3_q29up7,TheBidenshitshow,WokePokeBowl,1633481998000,link,twitter.com,It's Over.,29,8,https://twitter.com/bennyjohnson/status/1445494657547325449,https://old.reddit.com/r/TheBidenshitshow/comments/q29up7/its_over/
thing_t3_q1d1fg,science,WokePokeBowl,1633375889000,link,journals.plos.org,BMI has a consistent causal role in increasing risk of digestive system cancers,34,8,https://journals.plos.org/plosmedicine/article?id=10.1371/journal.pmed.1003706,https://old.reddit.com/r/science/comments/q1d1fg/bmi_has_a_consistent_causal_role_in_increasing/
thing_t3_pytcy3,RedditCensors,WokePokeBowl,1633037366000,text,,Permabanned from r/Virginia for posting an AP article describing COVIDs 99% survival rate and an Oxford study concluding Delta viral loads are the same between vaxxed/unvaxxed when a user claims the unvaccinated are killing children.,59,33,,https://old.reddit.com/r/RedditCensors/comments/pytcy3/permabanned_from_rvirginia_for_posting_an_ap/
thing_t3_pys6jc,tucker_carlson,WokePokeBowl,1633033766000,link,npr.org,"Reddit Darling NASA refuses to unperson James Webb for not being woke enough 70 years ago. Will not rename inanimate scientific instrument with no political power. ""WTF I hate science now,"" says r/AverageRedditor",28,2,https://www.npr.org/2021/09/30/1041707730/shadowed-by-controversy-nasa-wont-rename-new-space-telescope,https://old.reddit.com/r/tucker_carlson/comments/pys6jc/reddit_darling_nasa_refuses_to_unperson_james/
thing_t3_ppkl1y,tucker_carlson,WokePokeBowl,1631821635000,image,i.imgur.com,Huh?,151,16,https://i.imgur.com/smyFeng.jpg,https://old.reddit.com/r/tucker_carlson/comments/ppkl1y/huh/
thing_t3_poy14d,tucker_carlson,WokePokeBowl,1631736998000,image,i.redd.it,Reddit Approved Associated Press: the actual survival rate of all COVID-19 infections is even higher than 98.2%.,165,6,https://i.redd.it/quit0jus5qn71.jpg,https://old.reddit.com/r/tucker_carlson/comments/poy14d/reddit_approved_associated_press_the_actual/
thing_t3_pnmo6t,TheBidenshitshow,WokePokeBowl,1631561828000,link,reason.com,Reason: Biden's Vaccine Mandate Is the Latest Sign of the Presidency Becoming a Monarchy,64,7,https://reason.com/2021/09/13/bidens-vaccine-mandate-is-the-latest-sign-of-the-presidency-becoming-a-monarchy/,https://old.reddit.com/r/TheBidenshitshow/comments/pnmo6t/reason_bidens_vaccine_mandate_is_the_latest_sign/
thing_t3_pem4v0,centrist,WokePokeBowl,1630342546000,link,apnews.com,AP accidentally admits that Jan 6. rioters are being treated equally to those arrested for crimes during Floyd/BLM incidents.,3,51,https://apnews.com/article/records-rebut-claims-jan-6-rioters-55adf4d46aff57b91af2fdd3345dace8,https://old.reddit.com/r/centrist/comments/pem4v0/ap_accidentally_admits_that_jan_6_rioters_are/
thing_t3_pctb1f,AntiHateCommunities,WokePokeBowl,1630089543000,link,abc7chicago.com,"Money well spent: $50,000 used to remove a racist rock that was called a racist term almost 100 years ago. Fact: Calling something a bad word makes it bad.",50,7,https://abc7chicago.com/racist-rock-university-of-wisconsin-chamberlin-removed-from-madison-campus/10939064/,https://old.reddit.com/r/AntiHateCommunities/comments/pctb1f/money_well_spent_50000_used_to_remove_a_racist/
thing_t3_p7h377,loveforpit_bulls,WokePokeBowl,1629386998000,image,i.redd.it,When my pibbles sense a future bigot.,97,0,https://i.redd.it/6v6yvxzf2ci71.jpg,https://old.reddit.com/r/loveforpit_bulls/comments/p7h377/when_my_pibbles_sense_a_future_bigot/
thing_t3_p6vnud,TheBidenshitshow,WokePokeBowl,1629306986000,link,theguardian.com,"""Why would anyone pay $500,000 for a painting by Hunter Biden?"" The Guardian all but outright accuses Hunter Biden of money laundering",84,1,https://www.theguardian.com/commentisfree/2021/aug/17/why-would-anyone-pay-500000-for-a-painting-by-hunter-biden,https://old.reddit.com/r/TheBidenshitshow/comments/p6vnud/why_would_anyone_pay_500000_for_a_painting_by/
thing_t3_p4cz0t,TheBidenshitshow,WokePokeBowl,1628964407000,link,justthenews.com,"Biden admin instructs unlawful migrants to be bused to Austin, Dallas, and Houston without COVID testing or quarantine.",305,22,https://justthenews.com/government/federal-agencies/illegal-migrants-be-released-austin-dallas-houston-under-laredo-dhs#article,https://old.reddit.com/r/TheBidenshitshow/comments/p4cz0t/biden_admin_instructs_unlawful_migrants_to_be/
thing_t3_p2konx,loveforpit_bulls,WokePokeBowl,1628711554000,link,philadelphia.cbslocal.com,"Philadelphia Woman's Pibble ""Mistakenly"" Euthanized by Animal Control",16,1,https://philadelphia.cbslocal.com/2021/08/09/philadelphia-womans-dog-mistakenly-euthanized-by-acct-philly/?fbclid=IwAR1LsXtb0MQAKoAkeLRPkHe7HZQglG5DI-wDDM9jLzWI6B117RqUX5eYjs0,https://old.reddit.com/r/loveforpit_bulls/comments/p2konx/philadelphia_womans_pibble_mistakenly_euthanized/
thing_t3_nfjw9c,tucker_carlson,WokePokeBowl,1621366362000,image,i.redd.it,"The Left: ""BELIEVE IN MUH SCIENCE"" Also the Left: 41% of Democrats believe at least half of people who get COVID must be hospitalized. 😂 (infographic source: New York Times FT-Gallup)",451,27,https://i.redd.it/1ybp1jntjxz61.png,https://old.reddit.com/r/tucker_carlson/comments/nfjw9c/the_left_believe_in_muh_science_also_the_left_41/
thing_t3_nfhaxz,SocialJusticeInAction,WokePokeBowl,1621360346000,image,i.redd.it,"""Masks aren't political, it's science."" Also the left:",420,49,https://i.redd.it/skm1zfg32xz61.png,https://old.reddit.com/r/SocialJusticeInAction/comments/nfhaxz/masks_arent_political_its_science_also_the_left/
thing_t3_neifi5,SocialJusticeInAction,WokePokeBowl,1621263412000,link,archive.is,"Gender Affirmation Therapy: Children are suffering from osteoporosis, and possible added risk of heart attack, stroke, sterility, and cognitive decline. ~The Economist",52,13,https://archive.is/rKi8Y,https://old.reddit.com/r/SocialJusticeInAction/comments/neifi5/gender_affirmation_therapy_children_are_suffering/
thing_t3_n0ifs9,tucker_carlson,WokePokeBowl,1619626590000,text,,It's Almost as Though Some People with Underlying Health Conditions Can Die When Being Lawfully Restrained By Police,1,2,,https://old.reddit.com/r/tucker_carlson/comments/n0ifs9/its_almost_as_though_some_people_with_underlying/
thing_t3_mi1br6,TheLeftCantMeme,WokePokeBowl,1617300721000,image,i.imgur.com,Presented without further comment,1,1,https://i.imgur.com/wMrD2sR.jpg,https://old.reddit.com/r/TheLeftCantMeme/comments/mi1br6/presented_without_further_comment/
thing_t3_maxcpc,usps_complaints,WokePokeBowl,1616445473000,text,,Thieving fucking bums,8,6,,https://old.reddit.com/r/usps_complaints/comments/maxcpc/thieving_fucking_bums/
thing_t3_lymmya,tucker_carlson,WokePokeBowl,1614980550000,link,archive.is,"Body Positivity vs ""I love Science:"" Most coronavirus deaths have occurred in countries where majority of adults are overweight",0,2,https://archive.is/FxhON,https://old.reddit.com/r/tucker_carlson/comments/lymmya/body_positivity_vs_i_love_science_most/
thing_t3_r6vw1j,SocialJusticeInAction,ExtHD,1638410764000,link,rt.com,Woke radicals will ensure Kyle Rittenhouse never leads a normal life,22,5,https://www.rt.com/op-ed/541755-kyle-rittenhouse-life-cancel/,https://old.reddit.com/r/SocialJusticeInAction/comments/r6vw1j/woke_radicals_will_ensure_kyle_rittenhouse_never/
thing_t3_r6ve5s,SocialJusticeInAction,ExtHD,1638409290000,link,rt.com,Why are kids with gender dysphoria being treated like lab rats?,23,11,https://www.rt.com/op-ed/541785-kids-gender-dysphoria-puberty-blockers/,https://old.reddit.com/r/SocialJusticeInAction/comments/r6ve5s/why_are_kids_with_gender_dysphoria_being_treated/
thing_t3_r6uw41,worldpolitics2,ExtHD,1638407799000,link,orinocotribune.com,Venezuela National Assembly President Jorge Rodríguez: We Are Not and Will Not Be Anyone’s Colony,5,0,https://orinocotribune.com/jorge-rodriguez-we-are-not-and-will-not-be-anyones-colony/,https://old.reddit.com/r/worldpolitics2/comments/r6uw41/venezuela_national_assembly_president_jorge/
thing_t3_r6vvai,World_Politics,ExtHD,1638410698000,link,rt.com,Woke radicals will ensure Kyle Rittenhouse never leads a normal life,2,0,https://www.rt.com/op-ed/541755-kyle-rittenhouse-life-cancel/,https://old.reddit.com/r/World_Politics/comments/r6vvai/woke_radicals_will_ensure_kyle_rittenhouse_never/
thing_t3_r6v60g,whatsreallygoinon,ExtHD,1638408622000,link,rt.com,Big Pharma unites Americans in disdain,2,0,https://www.rt.com/usa/541918-big-pharma-poll-distrust/,https://old.reddit.com/r/whatsreallygoinon/comments/r6v60g/big_pharma_unites_americans_in_disdain/
thing_t3_r6wu9y,World_Politics,ExtHD,1638413528000,link,alethonews.com,French troops violently disrespect African populations during anti-occupation demonstrations,1,0,https://alethonews.com/2021/12/01/french-troops-violently-disrespect-african-populations-during-anti-occupation-demonstrations/,https://old.reddit.com/r/World_Politics/comments/r6wu9y/french_troops_violently_disrespect_african/
thing_t3_r6vnry,World_Politics,ExtHD,1638410102000,link,rt.com,New AOC book is another level of cringe worship,0,0,https://www.rt.com/op-ed/541791-aoc-book-essays-celebrity/,https://old.reddit.com/r/World_Politics/comments/r6vnry/new_aoc_book_is_another_level_of_cringe_worship/
thing_t3_r6vevx,World_Politics,ExtHD,1638409353000,link,rt.com,Why are kids with gender dysphoria being treated like lab rats?,1,0,https://www.rt.com/op-ed/541785-kids-gender-dysphoria-puberty-blockers/,https://old.reddit.com/r/World_Politics/comments/r6vevx/why_are_kids_with_gender_dysphoria_being_treated/
thing_t3_r6v55x,World_Politics,ExtHD,1638408551000,link,rt.com,Big Pharma unites Americans in disdain,1,0,https://www.rt.com/usa/541918-big-pharma-poll-distrust/,https://old.reddit.com/r/World_Politics/comments/r6v55x/big_pharma_unites_americans_in_disdain/
thing_t3_r6v11p,World_Politics,ExtHD,1638408212000,link,syriatimes.sy,Lavrov: Russia will continue its efforts to crush terrorism in Syria completely,1,0,http://syriatimes.sy/index.php/news/international/59376-lavrov-russia-will-continue-its-efforts-to-eliminate-terrorism-once-and-for-all-in-syria,https://old.reddit.com/r/World_Politics/comments/r6v11p/lavrov_russia_will_continue_its_efforts_to_crush/
thing_t3_r6ujlh,World_Politics,ExtHD,1638406800000,link,orinocotribune.com,Venezuela National Assembly President Jorge Rodríguez: We Are Not and Will Not Be Anyone’s Colony,1,0,https://orinocotribune.com/jorge-rodriguez-we-are-not-and-will-not-be-anyones-colony/,https://old.reddit.com/r/World_Politics/comments/r6ujlh/venezuela_national_assembly_president_jorge/
thing_t3_r6ub4e,World_Politics,ExtHD,1638406136000,link,ericpetersautos.com,Let Them Eat Volts!,1,0,https://www.ericpetersautos.com/2021/11/29/let-them-eat-volts/,https://old.reddit.com/r/World_Politics/comments/r6ub4e/let_them_eat_volts/
thing_t3_r604v3,Sino,ExtHD,1638313785000,link,oneworld.press,The China-ASEAN Strategic Partnership Is An Example For The World,96,0,http://oneworld.press/?module=articles&action=view&id=2335,https://old.reddit.com/r/Sino/comments/r604v3/the_chinaasean_strategic_partnership_is_an/
thing_t3_r620ej,SocialJusticeInAction,ExtHD,1638319270000,link,clarion.causeaction.com,A Tale of Two Cities: Kenosha vs. Waukesha,45,5,https://clarion.causeaction.com/2021/11/29/a-tale-of-two-cities-kenosha-vs-waukesha/,https://old.reddit.com/r/SocialJusticeInAction/comments/r620ej/a_tale_of_two_cities_kenosha_vs_waukesha/
thing_t3_r5yxny,GlobalLockdown,ExtHD,1638310451000,link,consentfactory.org,"Pathologized Totalitarianism 101 - Despite the most intensive propaganda campaign in the history of propaganda campaigns, there remain enough of us who steadfastly refuse to accept the “New Normal” as our new reality.",52,3,https://consentfactory.org/2021/11/22/pathologized-totalitarianism-101/,https://old.reddit.com/r/GlobalLockdown/comments/r5yxny/pathologized_totalitarianism_101_despite_the_most/
thing_t3_r618yf,SocialJusticeInAction,ExtHD,1638317030000,link,survivalmagazine.org,PETA Launches ‘Human Leather’ Shop to Save Cows… While Killing Thousands of Puppies and Kittens,32,5,https://survivalmagazine.org/news/peta-launches-human-leather-shop-to-save-cows-while-killing-thousands-of-puppies-and-kittens/,https://old.reddit.com/r/SocialJusticeInAction/comments/r618yf/peta_launches_human_leather_shop_to_save_cows/
thing_t3_r5ziqu,warcrimes,ExtHD,1638312069000,link,progressive.org,"The Pentagon Doesn’t Care About Civilian Casualties - Facing little opposition from either Republicans or Democrats, the U.S. military is almost never held accountable for killing civilians during airstrikes.",16,0,https://progressive.org/latest/pentagon-doesnt-care-about-civilian-casualties-zunes-211126/,https://old.reddit.com/r/warcrimes/comments/r5ziqu/the_pentagon_doesnt_care_about_civilian/
thing_t3_r5y0e7,CoronavirusCirclejerk,ExtHD,1638307927000,link,lewrockwell.com,Hard Data Shows the Covid Vaccines Don’t Work,20,1,https://www.lewrockwell.com/2021/11/vasko-kohlmayer/hard-data-shows-the-covid-vaccines-dont-work/,https://old.reddit.com/r/CoronavirusCirclejerk/comments/r5y0e7/hard_data_shows_the_covid_vaccines_dont_work/
thing_t3_r5xz6h,DebateVaccines,ExtHD,1638307831000,link,lewrockwell.com,Hard Data Shows the Covid Vaccines Don’t Work,17,14,https://www.lewrockwell.com/2021/11/vasko-kohlmayer/hard-data-shows-the-covid-vaccines-dont-work/,https://old.reddit.com/r/DebateVaccines/comments/r5xz6h/hard_data_shows_the_covid_vaccines_dont_work/
thing_t3_r5zj9y,WesternTerrorism,ExtHD,1638312112000,link,progressive.org,"The Pentagon Doesn’t Care About Civilian Casualties - Facing little opposition from either Republicans or Democrats, the U.S. military is almost never held accountable for killing civilians during airstrikes.",10,3,https://progressive.org/latest/pentagon-doesnt-care-about-civilian-casualties-zunes-211126/,https://old.reddit.com/r/WesternTerrorism/comments/r5zj9y/the_pentagon_doesnt_care_about_civilian/
thing_t3_r604e6,worldpolitics2,ExtHD,1638313747000,link,oneworld.press,The China-ASEAN Strategic Partnership Is An Example For The World,6,0,http://oneworld.press/?module=articles&action=view&id=2335,https://old.reddit.com/r/worldpolitics2/comments/r604e6/the_chinaasean_strategic_partnership_is_an/
thing_t3_r5z6cw,antiwar,ExtHD,1638311116000,link,original.antiwar.com,The Usual Suspects Are Trying to Foment a Crisis With Russia,8,0,https://original.antiwar.com/ted_galen_carpenter/2021/11/29/the-usual-suspects-are-trying-to-foment-a-crisis-with-russia/,https://old.reddit.com/r/antiwar/comments/r5z6cw/the_usual_suspects_are_trying_to_foment_a_crisis/
thing_t3_r5xzwf,VaccineNarrative,ExtHD,1638307888000,link,lewrockwell.com,Hard Data Shows the Covid Vaccines Don’t Work,10,0,https://www.lewrockwell.com/2021/11/vasko-kohlmayer/hard-data-shows-the-covid-vaccines-dont-work/,https://old.reddit.com/r/VaccineNarrative/comments/r5xzwf/hard_data_shows_the_covid_vaccines_dont_work/
thing_t3_r64jy7,propaganda,ExtHD,1638327154000,link,townhall.com,"The Incredible, Vanishing National News Story in Waukesha - Once details began to emerge, and the alleged perpetrator was identified, the big media machine ground to a halt, and the would-be deluge was reduced to a trickle.",4,1,https://townhall.com/tipsheet/guybenson/2021/11/29/the-incredible-vanishing-national-news-story-in-waukesha-n2599755,https://old.reddit.com/r/propaganda/comments/r64jy7/the_incredible_vanishing_national_news_story_in/
thing_t3_r5z4oz,worldpolitics2,ExtHD,1638310987000,link,original.antiwar.com,The Usual Suspects Are Trying to Foment a Crisis With Russia,5,0,https://original.antiwar.com/ted_galen_carpenter/2021/11/29/the-usual-suspects-are-trying-to-foment-a-crisis-with-russia/,https://old.reddit.com/r/worldpolitics2/comments/r5z4oz/the_usual_suspects_are_trying_to_foment_a_crisis/
thing_t3_r627xt,World_Politics,ExtHD,1638319897000,link,globaltimes.cn,"Boycott Beijing Winter Olympics? China never plans to invite these US politicians who hype the ""boycott"" topic",3,0,https://www.globaltimes.cn/page/202111/1240172.shtml,https://old.reddit.com/r/World_Politics/comments/r627xt/boycott_beijing_winter_olympics_china_never_plans/
thing_t3_r63a11,climateskeptics,ExtHD,1638323126000,link,realclearscience.com,Green Technologies Have a Glaring Problem of Scale,2,1,https://www.realclearscience.com/articles/2021/11/27/green_technologies_have_a_glaring_problem_of_scale_805367.html,https://old.reddit.com/r/climateskeptics/comments/r63a11/green_technologies_have_a_glaring_problem_of_scale/
thing_t3_r5ao1s,GoldandBlack,ExtHD,1638234171000,link,ronpaulinstitute.org,Reduce Expectations of Government - Some pundits have suggested that the way to cope with higher prices and reduced availability of goods is for people to “lower their expectations.” These pundits have unwittingly stumbled into the truth: The people should lower their expectations of government.,164,5,http://ronpaulinstitute.org/archives/featured-articles/2021/november/29/reduce-expectations-of-government/,https://old.reddit.com/r/GoldandBlack/comments/r5ao1s/reduce_expectations_of_government_some_pundits/
thing_t3_r61x5q,World_Politics,ExtHD,1638319004000,link,clarion.causeaction.com,A Tale of Two Cities: Kenosha vs. Waukesha,2,0,https://clarion.causeaction.com/2021/11/29/a-tale-of-two-cities-kenosha-vs-waukesha/,https://old.reddit.com/r/World_Politics/comments/r61x5q/a_tale_of_two_cities_kenosha_vs_waukesha/
thing_t3_r5838s,FightingFakeNews,ExtHD,1638226717000,link,themarketholders.com,Fake News Media Claims 5X Increase in Healthy World-Class Athletes Who Suddenly Collapse Holding Their Chest is Just a “Coincidence” and Nothing to “Panic” Over,172,9,https://themarketholders.com/2021/11/29/fake-news-media-claims-5x-increase-in-healthy-world-class-athletes-who-suddenly-collapse-holding-their-chest-is-just-a-coincidence-and-nothing-to-panic-over/,https://old.reddit.com/r/FightingFakeNews/comments/r5838s/fake_news_media_claims_5x_increase_in_healthy/
thing_t3_r603y8,World_Politics,ExtHD,1638313709000,link,oneworld.press,The China-ASEAN Strategic Partnership Is An Example For The World,2,0,http://oneworld.press/?module=articles&action=view&id=2335,https://old.reddit.com/r/World_Politics/comments/r603y8/the_chinaasean_strategic_partnership_is_an/
thing_t3_r64hha,World_Politics,ExtHD,1638326945000,link,townhall.com,"The Incredible, Vanishing National News Story in Waukesha",1,0,https://townhall.com/tipsheet/guybenson/2021/11/29/the-incredible-vanishing-national-news-story-in-waukesha-n2599755,https://old.reddit.com/r/World_Politics/comments/r64hha/the_incredible_vanishing_national_news_story_in/
thing_t3_r5zi3w,World_Politics,ExtHD,1638312019000,link,progressive.org,"The Pentagon Doesn’t Care About Civilian Casualties - Facing little opposition from either Republicans or Democrats, the U.S. military is almost never held accountable for killing civilians during airstrikes.",2,0,https://progressive.org/latest/pentagon-doesnt-care-about-civilian-casualties-zunes-211126/,https://old.reddit.com/r/World_Politics/comments/r5zi3w/the_pentagon_doesnt_care_about_civilian/
thing_t3_r639ho,World_Politics,ExtHD,1638323077000,link,realclearscience.com,Green Technologies Have a Glaring Problem of Scale,1,0,https://www.realclearscience.com/articles/2021/11/27/green_technologies_have_a_glaring_problem_of_scale_805367.html,https://old.reddit.com/r/World_Politics/comments/r639ho/green_technologies_have_a_glaring_problem_of_scale/
thing_t3_r54rti,CoronavirusCirclejerk,ExtHD,1638217549000,image,i.redd.it,Who do you believe now?,186,7,https://old.reddit.com/r/CoronavirusCirclejerk/comments/r54rti/who_do_you_believe_now/,https://old.reddit.com/r/CoronavirusCirclejerk/comments/r54rti/who_do_you_believe_now/
thing_t3_r61zro,propaganda,ExtHD,1638319216000,link,clarion.causeaction.com,A Tale of Two Cities: Kenosha vs. Waukesha,0,0,https://clarion.causeaction.com/2021/11/29/a-tale-of-two-cities-kenosha-vs-waukesha/,https://old.reddit.com/r/propaganda/comments/r61zro/a_tale_of_two_cities_kenosha_vs_waukesha/
thing_t3_r61y3i,whatsreallygoinon,ExtHD,1638319084000,link,clarion.causeaction.com,A Tale of Two Cities: Kenosha vs. Waukesha,1,0,https://clarion.causeaction.com/2021/11/29/a-tale-of-two-cities-kenosha-vs-waukesha/,https://old.reddit.com/r/whatsreallygoinon/comments/r61y3i/a_tale_of_two_cities_kenosha_vs_waukesha/
thing_t3_r5zk0x,whatsreallygoinon,ExtHD,1638312169000,link,progressive.org,"The Pentagon Doesn’t Care About Civilian Casualties - Facing little opposition from either Republicans or Democrats, the U.S. military is almost never held accountable for killing civilians during airstrikes.",1,0,https://progressive.org/latest/pentagon-doesnt-care-about-civilian-casualties-zunes-211126/,https://old.reddit.com/r/whatsreallygoinon/comments/r5zk0x/the_pentagon_doesnt_care_about_civilian/
thing_t3_r5z40z,World_Politics,ExtHD,1638310935000,link,original.antiwar.com,The Usual Suspects Are Trying to Foment a Crisis With Russia,1,0,https://original.antiwar.com/ted_galen_carpenter/2021/11/29/the-usual-suspects-are-trying-to-foment-a-crisis-with-russia/,https://old.reddit.com/r/World_Politics/comments/r5z40z/the_usual_suspects_are_trying_to_foment_a_crisis/
