post_id,subreddit,author,timestamp,type,domain,title,score,comments_count,link,comments
thing_t3_p99wj3,geopolitics,deperrucha,1629626772000,link,expatica.com,People from Western Sahara deemed stateless in Switzerland - Expat Guide to Switzerland.,1,1,https://www.expatica.com/ch/latest-news/sw-people-from-western-sahara-deemed-stateless-in-switzerland-218515/,https://old.reddit.com/r/geopolitics/comments/p99wj3/people_from_western_sahara_deemed_stateless_in/
thing_t3_p99qnc,europe,deperrucha,1629625842000,link,expatica.com,People from Western Sahara deemed stateless in Switzerland - Expat Guide to Switzerland,1,5,https://www.expatica.com/ch/latest-news/sw-people-from-western-sahara-deemed-stateless-in-switzerland-218515/,https://old.reddit.com/r/europe/comments/p99qnc/people_from_western_sahara_deemed_stateless_in/
thing_t3_p99q3k,Africa,deperrucha,1629625756000,link,allafrica.com,Western Sahara: Need to Uphold Principle of Intangibility of Borders Inherited At Independence,1,1,https://allafrica.com/stories/202108200733.html,https://old.reddit.com/r/Africa/comments/p99q3k/western_sahara_need_to_uphold_principle_of/
thing_t3_p8kykz,europe,deperrucha,1629519924000,link,spsrasd.info,UN experts express concern over journalists and activists situation in the occupied areas of Western Sahara,2,4,https://www.spsrasd.info/news/en/articles/2021/08/19/34859.html,https://old.reddit.com/r/europe/comments/p8kykz/un_experts_express_concern_over_journalists_and/
thing_t3_p88cl5,Africa,deperrucha,1629475899000,link,aljazeera.com,"Algeria blames groups it links to Morocco, Israel for wildfires",11,7,https://www.aljazeera.com/news/2021/8/19/algeria-review-relations-morocco-israel-wildfires,https://old.reddit.com/r/Africa/comments/p88cl5/algeria_blames_groups_it_links_to_morocco_israel/
thing_t3_p87z65,humanrights,deperrucha,1629474780000,link,spsrasd.info,UN experts express concern over journalists and activists situation in the occupied areas of Western Sahara,2,0,https://www.spsrasd.info/news/en/articles/2021/08/19/34859.html,https://old.reddit.com/r/humanrights/comments/p87z65/un_experts_express_concern_over_journalists_and/
thing_t3_p88qft,algeria,deperrucha,1629477073000,link,aljazeera.com,"Algeria blames groups it links to Morocco, Israel for wildfires",1,0,https://www.aljazeera.com/news/2021/8/19/algeria-review-relations-morocco-israel-wildfires,https://old.reddit.com/r/algeria/comments/p88qft/algeria_blames_groups_it_links_to_morocco_israel/
thing_t3_p882yx,Africa,deperrucha,1629475111000,link,spsrasd.info,Need to uphold principle of intangibility of borders inherited at independence,0,2,https://www.spsrasd.info/news/en/articles/2021/08/20/34873.html,https://old.reddit.com/r/Africa/comments/p882yx/need_to_uphold_principle_of_intangibility_of/
thing_t3_p87zvo,Africa,deperrucha,1629474842000,link,spsrasd.info,UN experts express concern over journalists and activists situation in the occupied areas of Western Sahara,1,7,https://www.spsrasd.info/news/en/articles/2021/08/19/34859.html,https://old.reddit.com/r/Africa/comments/p87zvo/un_experts_express_concern_over_journalists_and/
thing_t3_p4c55y,worldnews,deperrucha,1628961679000,link,ohchr.org,Spyware scandal: UN experts call for moratorium on sale of ‘life threatening’ surveillance tech,46,1,https://www.ohchr.org/FR/NewsEvents/Pages/DisplayNews.aspx?NewsID=27379&LangID=E,https://old.reddit.com/r/worldnews/comments/p4c55y/spyware_scandal_un_experts_call_for_moratorium_on/
thing_t3_p48dln,worldnews,deperrucha,1628949040000,link,al-monitor.com,UN panel calls for cybersurveillance sale freeze amid Pegasus scandal,31,0,https://www.al-monitor.com/originals/2021/08/un-panel-calls-cybersurveillance-sale-freeze-amid-pegasus-scandal,https://old.reddit.com/r/worldnews/comments/p48dln/un_panel_calls_for_cybersurveillance_sale_freeze/
thing_t3_p4c5j4,europe,deperrucha,1628961710000,link,ohchr.org,Spyware scandal: UN experts call for moratorium on sale of ‘life threatening’ surveillance tech,13,3,https://www.ohchr.org/FR/NewsEvents/Pages/DisplayNews.aspx?NewsID=27379&LangID=E,https://old.reddit.com/r/europe/comments/p4c5j4/spyware_scandal_un_experts_call_for_moratorium_on/
thing_t3_p45qjk,Galiza,deperrucha,1628937524000,link,publico.es,"El principio del fin de Ence, la empresa que contaminó con mercurio la ría de Pontevedra y que llenó Galicia de eucaliptos",33,1,https://www.publico.es/economia/principio-ence-empresa-contamino-mercurio-ria-pontevedra-lleno-galicia-eucaliptos.html,https://old.reddit.com/r/Galiza/comments/p45qjk/el_principio_del_fin_de_ence_la_empresa_que/
thing_t3_p48emr,worldnews,deperrucha,1628949146000,link,marketresearchtelecast.com,Morocco signs Spanish law firm Díaz-Bastien to defend itself against espionage accusations,15,8,https://marketresearchtelecast.com/morocco-signs-spanish-law-firm-diaz-bastien-to-defend-itself-against-espionage-accusations/123785/,https://old.reddit.com/r/worldnews/comments/p48emr/morocco_signs_spanish_law_firm_díazbastien_to/
thing_t3_p4892k,worldnews,deperrucha,1628948560000,link,frontline.thehindu.com,Morocco's protests foresee possible 'Arab Spring' moment,16,3,https://frontline.thehindu.com/dispatches/morocco-protests-arab-spring-2021/article35893426.ece,https://old.reddit.com/r/worldnews/comments/p4892k/moroccos_protests_foresee_possible_arab_spring/
thing_t3_p4c65i,europe,deperrucha,1628961764000,link,thewire.in,We Can Learn a Lot from Modi and Macron's Contrasting Responses to Pegasus Revelations,10,1,https://thewire.in/tech/supreme-court-modi-macron-pegasus,https://old.reddit.com/r/europe/comments/p4c65i/we_can_learn_a_lot_from_modi_and_macrons/
thing_t3_p4elzb,SpainPolitics,deperrucha,1628969936000,link,elfarodeceuta.es,Periodista español espiado: Pegasus concienciará a las autoridades mundiales,3,3,https://elfarodeceuta.es/periodista-espanol-espiado-pegasus-concienciara-autoridades-mundiales/,https://old.reddit.com/r/SpainPolitics/comments/p4elzb/periodista_español_espiado_pegasus_concienciará_a/
thing_t3_p4c6ue,humanrights,deperrucha,1628961828000,link,ohchr.org,Spyware scandal: UN experts call for moratorium on sale of ‘life threatening’ surveillance tech,5,1,https://www.ohchr.org/FR/NewsEvents/Pages/DisplayNews.aspx?NewsID=27379&LangID=E,https://old.reddit.com/r/humanrights/comments/p4c6ue/spyware_scandal_un_experts_call_for_moratorium_on/
thing_t3_p4bofu,europe,deperrucha,1628960152000,link,marketresearchtelecast.com,Morocco signs Spanish law firm Díaz-Bastien to defend itself against espionage accusations,5,10,https://marketresearchtelecast.com/morocco-signs-spanish-law-firm-diaz-bastien-to-defend-itself-against-espionage-accusations/123785/,https://old.reddit.com/r/europe/comments/p4bofu/morocco_signs_spanish_law_firm_díazbastien_to/
thing_t3_p48ose,Africa,deperrucha,1628950176000,link,egyptindependent.com,Is Morocco's 'Arab Spring' moment finally here?,5,34,https://www.egyptindependent.com/is-moroccos-arab-spring-moment-finally-here/,https://old.reddit.com/r/Africa/comments/p48ose/is_moroccos_arab_spring_moment_finally_here/
thing_t3_p4bl1w,humanrights,deperrucha,1628959841000,link,cpj.org,Sherif-Mansour-testimony. Human Rights and Freedom of Expression in Morocco.,1,3,https://cpj.org/wp-content/uploads/2021/08/Sherif-Mansour-testimony.pdf,https://old.reddit.com/r/humanrights/comments/p4bl1w/sherifmansourtestimony_human_rights_and_freedom/
thing_t3_p48bff,worldnews,deperrucha,1628948813000,link,thewire.in,We Can Learn a Lot from Modi and Macron's Contrasting Responses to Pegasus Revelations,0,0,https://thewire.in/tech/supreme-court-modi-macron-pegasus,https://old.reddit.com/r/worldnews/comments/p48bff/we_can_learn_a_lot_from_modi_and_macrons/
thing_t3_p4etgi,france,deperrucha,1628970638000,link,la-croix.com,Pegasus : la riposte marocaine aux accusations d’espionnage,0,6,https://www.la-croix.com/Monde/Pegasus-riposte-marocaine-accusations-despionnage-2021-08-11-1201170325,https://old.reddit.com/r/france/comments/p4etgi/pegasus_la_riposte_marocaine_aux_accusations/
thing_t3_p3vdpk,humanrights,deperrucha,1628892606000,link,dw.com,Is Morocco's 'Arab Spring' moment finally here? | DW | 12.08.2021,6,2,https://www.dw.com/en/is-moroccos-arab-spring-moment-finally-here/a-58846817,https://old.reddit.com/r/humanrights/comments/p3vdpk/is_moroccos_arab_spring_moment_finally_here_dw/
thing_t3_p3ub8x,worldnews,deperrucha,1628889160000,link,trtworld.com,Hundreds protest as Moroccan 'sets himself alight' after cart seized,9,6,https://www.trtworld.com/africa/hundreds-protest-as-moroccan-sets-himself-alight-after-cart-seized-49049,https://old.reddit.com/r/worldnews/comments/p3ub8x/hundreds_protest_as_moroccan_sets_himself_alight/
thing_t3_p3p2rd,podemos,deperrucha,1628873449000,image,i.redd.it,De memes y memas,23,0,https://old.reddit.com/r/podemos/comments/p3p2rd/de_memes_y_memas/,https://old.reddit.com/r/podemos/comments/p3p2rd/de_memes_y_memas/
thing_t3_p3qw1u,worldnews,deperrucha,1628878694000,link,dw.com,Is Morocco's 'Arab Spring' moment finally here? | DW | 12.08.2021,11,7,https://www.dw.com/en/is-moroccos-arab-spring-moment-finally-here/a-58846817,https://old.reddit.com/r/worldnews/comments/p3qw1u/is_moroccos_arab_spring_moment_finally_here_dw/
thing_t3_p3v53i,Africa,deperrucha,1628891826000,link,dw.com,Is Morocco's 'Arab Spring' moment finally here? | DW | 12.08.2021,2,2,https://www.dw.com/en/is-moroccos-arab-spring-moment-finally-here/a-58846817,https://old.reddit.com/r/Africa/comments/p3v53i/is_moroccos_arab_spring_moment_finally_here_dw/
thing_t3_ox2r9w,MapPorn,deperrucha,1627994877000,image,i.redd.it,Africa Map. Authors: W. & D. Lizars. Published in Edinburgh in 1818.,63,10,https://old.reddit.com/r/MapPorn/comments/ox2r9w/africa_map_authors_w_d_lizars_published_in/,https://old.reddit.com/r/MapPorn/comments/ox2r9w/africa_map_authors_w_d_lizars_published_in/
thing_t3_ox0ady,MapPorn,deperrucha,1627984955000,image,i.redd.it,Map of Africa. By Charles Price & John Senex. Published in London by the authors in 1711.,39,3,https://old.reddit.com/r/MapPorn/comments/ox0ady/map_of_africa_by_charles_price_john_senex/,https://old.reddit.com/r/MapPorn/comments/ox0ady/map_of_africa_by_charles_price_john_senex/
thing_t3_owiy7w,MapPorn,deperrucha,1627924103000,image,i.redd.it,"Map of Africa, 1866. In Mitchell's School Atlas",41,22,https://old.reddit.com/r/MapPorn/comments/owiy7w/map_of_africa_1866_in_mitchells_school_atlas/,https://old.reddit.com/r/MapPorn/comments/owiy7w/map_of_africa_1866_in_mitchells_school_atlas/
thing_t3_ow96ow,europe,deperrucha,1627886703000,link,ft.com,Spying allegations strain Morocco’s ties with France. Rabat denies bugging Macron’s phone but kingdom’s foreign policy has become more assertive.,9,25,https://www.ft.com/content/38d2cae9-4aa2-4da0-805e-a71b7c72ab7a,https://old.reddit.com/r/europe/comments/ow96ow/spying_allegations_strain_moroccos_ties_with/
thing_t3_or2s8v,MapPorn,deperrucha,1627178114000,image,i.redd.it,Western Sahara 🇪🇭 Africa’s last colony,177,119,https://i.redd.it/1f2fclo8l0261.jpg,https://old.reddit.com/r/MapPorn/comments/or2s8v/western_sahara_africas_last_colony/
thing_t3_oqw6iw,europe,deperrucha,1627153750000,link,amnesty.org,Scale of secretive cyber surveillance ‘an international human rights crisis’ in which NSO Group is complicit,11,1,https://www.amnesty.org/en/latest/news/2021/07/pegasus-project-spyware-digital-surveillance-nso/,https://old.reddit.com/r/europe/comments/oqw6iw/scale_of_secretive_cyber_surveillance_an/
thing_t3_oqy77e,geopolitics,deperrucha,1627160711000,link,thewire.in,Pegasus Project: How Morocco Took an Interest in French President Emmanuel Macron's Phone,0,5,https://thewire.in/world/pegasus-project-french-president-emmanuel-macron-surveillance-morocco-belgium-algeria,https://old.reddit.com/r/geopolitics/comments/oqy77e/pegasus_project_how_morocco_took_an_interest_in/
thing_t3_oqkelr,europe,deperrucha,1627107254000,link,spsrasd.info,French NGO criticizes Moroccan espionage against members and people close to the Association,12,2,https://www.spsrasd.info/news/en/articles/2021/07/22/33268.html,https://old.reddit.com/r/europe/comments/oqkelr/french_ngo_criticizes_moroccan_espionage_against/
thing_t3_oqkc7b,europe,deperrucha,1627106936000,link,newsrnd.com,"Pegasus project: targeted, Cédric Villani and François de Rugy will take legal action",8,15,https://newsrnd.com/news/2021-07-21-pegasus-project--targeted--c%C3%A9dric-villani-and-fran%C3%A7ois-de-rugy-will-take-legal-action.Hkb8FSSA_.html,https://old.reddit.com/r/europe/comments/oqkc7b/pegasus_project_targeted_cédric_villani_and/
thing_t3_oq0oq3,worldnews,deperrucha,1627040748000,link,rsf.org,“Disgraceful” prison sentences passed on two Moroccan journalists. | Reporters without borders,171,3,https://rsf.org/en/news/disgraceful-prison-sentences-passed-two-moroccan-journalists,https://old.reddit.com/r/worldnews/comments/oq0oq3/disgraceful_prison_sentences_passed_on_two/
thing_t3_oq0vob,europe,deperrucha,1627041528000,link,english.elpais.com,Spanish police seize large drone used to carry drugs from Morocco,141,47,https://english.elpais.com/spain/2021-07-15/spanish-police-seize-large-drone-used-to-carry-drugs-from-morocco.html,https://old.reddit.com/r/europe/comments/oq0vob/spanish_police_seize_large_drone_used_to_carry/
thing_t3_oq0y98,worldnews,deperrucha,1627041771000,link,middleeasteye.net,"Pegasus: From its own king to Algeria, the infinite reach of Morocco's intelligence services",59,6,https://www.middleeasteye.net/news/pegasus-morocco-king-macron-targeted-intelligence-reach,https://old.reddit.com/r/worldnews/comments/oq0y98/pegasus_from_its_own_king_to_algeria_the_infinite/
thing_t3_opy89z,worldnews,deperrucha,1627029480000,link,aa.com.tr,France launches investigation into Pegasus spyware,52,7,https://www.aa.com.tr/en/world/france-launches-investigation-into-pegasus-spyware/2311661,https://old.reddit.com/r/worldnews/comments/opy89z/france_launches_investigation_into_pegasus_spyware/
thing_t3_opzgh9,worldnews,deperrucha,1627035388000,link,euronews.com,More than 200 migrants climb fence to enter Spanish enclave of Melilla,26,20,https://www.euronews.com/2021/07/22/more-than-200-migrants-climb-fence-to-enter-spanish-enclave-of-melilla,https://old.reddit.com/r/worldnews/comments/opzgh9/more_than_200_migrants_climb_fence_to_enter/
thing_t3_opz9r8,worldnews,deperrucha,1627034492000,link,france24.com,Morocco court jails journalist Omar Radi for six years,19,2,https://www.france24.com/en/live-news/20210719-morocco-court-jails-journalist-omar-radi-for-six-years,https://old.reddit.com/r/worldnews/comments/opz9r8/morocco_court_jails_journalist_omar_radi_for_six/
thing_t3_oq321w,Galiza,deperrucha,1627049043000,link,nosdiario.gal,"Unha forma de visualizar o ""espolio"" eólico: deseña o mapa de muíños da túa vila á carta",8,3,https://www.nosdiario.gal/articulo/social/forma-visualizar-espolio-eolico-desena-mapa-muinos-da-tua-vila-carta/20210721213634125843.html,https://old.reddit.com/r/Galiza/comments/oq321w/unha_forma_de_visualizar_o_espolio_eólico_deseña/
thing_t3_oq4jbe,humanrights,deperrucha,1627053492000,link,indianexpress.com,Journalist’s monthslong hunger strike points to perils of reporting in Morocco,5,0,https://indianexpress.com/article/world/journalists-monthslong-hunger-strike-points-to-perils-of-reporting-in-morocco-7388246/,https://old.reddit.com/r/humanrights/comments/oq4jbe/journalists_monthslong_hunger_strike_points_to/
thing_t3_opy0zx,worldnews,deperrucha,1627028514000,link,amnesty.org,Morocco: Journalist harassed by authorities must be granted fair re-trial,14,1,https://www.amnesty.org/en/latest/news/2021/07/morocco-journalist-harassed-by-authorities-must-be-granted-fair-re-trial/,https://old.reddit.com/r/worldnews/comments/opy0zx/morocco_journalist_harassed_by_authorities_must/
thing_t3_opp9s9,europe,deperrucha,1626994650000,link,aa.com.tr,France launches investigation into Pegasus spyware,83,4,https://www.aa.com.tr/en/world/france-launches-investigation-into-pegasus-spyware/2311661,https://old.reddit.com/r/europe/comments/opp9s9/france_launches_investigation_into_pegasus_spyware/
thing_t3_opzxke,worldnews,deperrucha,1627037581000,link,aljazeera.com,Algeria recalls envoy to Morocco in row over Western Sahara,10,32,https://www.aljazeera.com/news/2021/7/18/algeria-recalls-envoy-to-morocco-in-row-over-western-sahara,https://old.reddit.com/r/worldnews/comments/opzxke/algeria_recalls_envoy_to_morocco_in_row_over/
thing_t3_oq12da,worldnews,deperrucha,1627042189000,link,middleeastmonitor.com,"Algeria army: 'We could have intervened in Morocco twice, but we did not'",5,2,https://www.middleeastmonitor.com/20210714-algeria-army-we-could-have-intervened-in-morocco-twice-but-we-did-not/,https://old.reddit.com/r/worldnews/comments/oq12da/algeria_army_we_could_have_intervened_in_morocco/
thing_t3_opxzih,worldnews,deperrucha,1627028316000,link,amnesty.org,Morocco/ Western Sahara: targeted crackdown of Sahrawi activists,5,1,https://www.amnesty.org/en/documents/mde29/4404/2021/en/,https://old.reddit.com/r/worldnews/comments/opxzih/morocco_western_sahara_targeted_crackdown_of/
thing_t3_opoxua,europe,deperrucha,1626993563000,link,thewire.in,Pegasus Project: How Morocco Took an Interest in French President Emmanuel Macron's Phone,34,11,https://thewire.in/world/pegasus-project-french-president-emmanuel-macron-surveillance-morocco-belgium-algeria,https://old.reddit.com/r/europe/comments/opoxua/pegasus_project_how_morocco_took_an_interest_in/
thing_t3_opfexk,europe,deperrucha,1626965633000,link,bloomberg.com,France Investigates Report Morocco Had Macron’s Phone Hacked,76,50,https://www.bloomberg.com/news/articles/2021-07-20/france-investigates-president-s-phone-hacking-by-morocco-report,https://old.reddit.com/r/europe/comments/opfexk/france_investigates_report_morocco_had_macrons/
thing_t3_opi6fj,europe,deperrucha,1626973531000,link,euractiv.com,Prodi was spied on by Moroccan secret services,44,12,https://www.euractiv.com/section/politics/short_news/prodi-was-spied-on-by-moroccan-secret-services/,https://old.reddit.com/r/europe/comments/opi6fj/prodi_was_spied_on_by_moroccan_secret_services/
thing_t3_ophh5d,MapPorn,deperrucha,1626971546000,image,i.redd.it,PEGASUS: THE NEW GLOBAL WEAPON FOR SILENCING JOURNALISTS At least 180 journalists around the world have been selected as targets by clients of the cybersurveillance company NSO Group,39,8,https://old.reddit.com/r/MapPorn/comments/ophh5d/pegasus_the_new_global_weapon_for_silencing/,https://old.reddit.com/r/MapPorn/comments/ophh5d/pegasus_the_new_global_weapon_for_silencing/
thing_t3_opapss,europe,deperrucha,1626947671000,link,mediapart.fr,What the Pegasus spyware tells us about Morocco: a dictatorship in all but name,45,42,https://www.mediapart.fr/en/journal/international/210721/what-pegasus-spyware-tells-us-about-morocco-dictatorship-all-name,https://old.reddit.com/r/europe/comments/opapss/what_the_pegasus_spyware_tells_us_about_morocco_a/
thing_t3_opaggd,podemos,deperrucha,1626946354000,link,google.com,Francia abre una investigación judicial por el espionaje marroquí a través de Pegasus,7,3,https://www.google.com/amp/s/www.elconfidencial.com/amp/mundo/2021-07-20/francia-abre-una-investigacion-judicial-por-el-espionaje-marroqui-a-traves-de-pegasus_3192832/,https://old.reddit.com/r/podemos/comments/opaggd/francia_abre_una_investigación_judicial_por_el/
thing_t3_opa83r,EUnews,deperrucha,1626945170000,link,mediapart.fr,What the Pegasus spyware tells us about Morocco: a dictatorship in all but name,1,1,https://www.mediapart.fr/en/journal/international/210721/what-pegasus-spyware-tells-us-about-morocco-dictatorship-all-name,https://old.reddit.com/r/EUnews/comments/opa83r/what_the_pegasus_spyware_tells_us_about_morocco_a/
thing_t3_opa7p9,EUnews,deperrucha,1626945114000,link,ft.com,France to investigate alleged spying attempt by Morocco,1,1,https://www.ft.com/content/0a0b880f-7142-4d63-ae13-e0436ed1e5b0,https://old.reddit.com/r/EUnews/comments/opa7p9/france_to_investigate_alleged_spying_attempt_by/
thing_t3_omzno4,europe,deperrucha,1626643219000,link,luhnoticias.es,Victims of Franco's regime demand before Congress that the State condemn that terror regime once and for all (in Spanish),20,32,https://luhnoticias.es/las-victimas-del-franquismo-exigen-ante-el-congreso-que-el-estado-condene-de-una-vez-aquel-regimen-de-terror/,https://old.reddit.com/r/europe/comments/omzno4/victims_of_francos_regime_demand_before_congress/
thing_t3_ole1qq,gaybros,deperrucha,1626430716000,image,i.redd.it,Legal Status of Homosexuality Worldwide.,396,78,https://i.redd.it/j175gzb3yib71.jpg,https://old.reddit.com/r/gaybros/comments/ole1qq/legal_status_of_homosexuality_worldwide/
thing_t3_okduz6,HumanPorn,deperrucha,1626297281000,image,i.redd.it,"Cristina García Rodero, Boys of Haiti, 2001",39,1,https://old.reddit.com/r/HumanPorn/comments/okduz6/cristina_garcía_rodero_boys_of_haiti_2001/,https://old.reddit.com/r/HumanPorn/comments/okduz6/cristina_garcía_rodero_boys_of_haiti_2001/
thing_t3_okdnkw,HumanPorn,deperrucha,1626296671000,image,i.redd.it,Cristina García Rodero (Hidden Spain serie) Heads of wax - 1977,16,2,https://old.reddit.com/r/HumanPorn/comments/okdnkw/cristina_garcía_rodero_hidden_spain_serie_heads/,https://old.reddit.com/r/HumanPorn/comments/okdnkw/cristina_garcía_rodero_hidden_spain_serie_heads/
thing_t3_oixftf,HumanPorn,deperrucha,1626115003000,image,i.redd.it,Sahrawi woman,561,8,https://old.reddit.com/r/HumanPorn/comments/oixftf/sahrawi_woman/,https://old.reddit.com/r/HumanPorn/comments/oixftf/sahrawi_woman/
thing_t3_oj2d5t,MapPorn,deperrucha,1626129725000,image,i.redd.it,Would you accept Muslims as members of your family?,110,92,https://old.reddit.com/r/MapPorn/comments/oj2d5t/would_you_accept_muslims_as_members_of_your_family/,https://old.reddit.com/r/MapPorn/comments/oj2d5t/would_you_accept_muslims_as_members_of_your_family/
thing_t3_oiypx7,humanrights,deperrucha,1626118864000,video,youtu.be,Western Sahara: Occupied. Betrayed. Ignored.,16,15,https://youtu.be/vVJx1DWrRcQ,https://old.reddit.com/r/humanrights/comments/oiypx7/western_sahara_occupied_betrayed_ignored/
thing_t3_oiz0bz,Marxism,deperrucha,1626119714000,text,,New York Bar Association open letter to President Biden on Western Sahara,6,3,,https://old.reddit.com/r/Marxism/comments/oiz0bz/new_york_bar_association_open_letter_to_president/
thing_t3_oiyt36,Refugees,deperrucha,1626119116000,video,youtu.be,Western Sahara: Occupied. Betrayed. Ignored.,3,1,https://youtu.be/vVJx1DWrRcQ,https://old.reddit.com/r/Refugees/comments/oiyt36/western_sahara_occupied_betrayed_ignored/
thing_t3_oiyrlp,humanrightsdenied,deperrucha,1626118994000,video,youtu.be,Western Sahara: Occupied. Betrayed. Ignored.,4,0,https://youtu.be/vVJx1DWrRcQ,https://old.reddit.com/r/humanrightsdenied/comments/oiyrlp/western_sahara_occupied_betrayed_ignored/
thing_t3_oiz232,Refugees,deperrucha,1626119867000,link,reddit.com,"The occupation of Western Sahara On the UN's map of remaining colonies in Africa, there is still one colony left.",3,0,https://www.reddit.com/r/MapPorn/comments/of69dj/the_occupation_of_western_sahara_on_the_uns_map/?utm_source=share&utm_medium=ios_app&utm_name=iossmf,https://old.reddit.com/r/Refugees/comments/oiz232/the_occupation_of_western_sahara_on_the_uns_map/
thing_t3_oj30f3,europe,deperrucha,1626131815000,link,reddit.com,Would you accept Muslims as members of your family?,2,1,https://www.reddit.com/r/MapPorn/comments/oj2d5t/would_you_accept_muslims_as_members_of_your_family/?utm_source=share&utm_medium=ios_app&utm_name=iossmf,https://old.reddit.com/r/europe/comments/oj30f3/would_you_accept_muslims_as_members_of_your_family/
thing_t3_oiz32a,humanrights,deperrucha,1626119950000,link,reddit.com,"The occupation of Western Sahara On the UN's map of remaining colonies in Africa, there is still one colony left.",1,0,https://www.reddit.com/r/MapPorn/comments/of69dj/the_occupation_of_western_sahara_on_the_uns_map/?utm_source=share&utm_medium=ios_app&utm_name=iossmf,https://old.reddit.com/r/humanrights/comments/oiz32a/the_occupation_of_western_sahara_on_the_uns_map/
thing_t3_oiyuyg,Sahara,deperrucha,1626119268000,video,youtu.be,Western Sahara: Occupied. Betrayed. Ignored.,1,0,https://youtu.be/vVJx1DWrRcQ,https://old.reddit.com/r/Sahara/comments/oiyuyg/western_sahara_occupied_betrayed_ignored/
thing_t3_ofy4nk,SahrawiRepublic,deperrucha,1625711964000,link,reddit.com,"The occupation of Western Sahara On the UN's map of remaining colonies in Africa, there is still one colony left.",6,0,https://www.reddit.com/r/MapPorn/comments/of69dj/the_occupation_of_western_sahara_on_the_uns_map/?utm_source=share&utm_medium=ios_app&utm_name=iossmf,https://old.reddit.com/r/SahrawiRepublic/comments/ofy4nk/the_occupation_of_western_sahara_on_the_uns_map/
thing_t3_of69dj,MapPorn,deperrucha,1625612352000,image,i.redd.it,"The occupation of Western Sahara On the UN's map of remaining colonies in Africa, there is still one colony left.",430,151,https://old.reddit.com/r/MapPorn/comments/of69dj/the_occupation_of_western_sahara_on_the_uns_map/,https://old.reddit.com/r/MapPorn/comments/of69dj/the_occupation_of_western_sahara_on_the_uns_map/
thing_t3_oealo3,europe,deperrucha,1625501614000,link,schengenvisainfo.com,Frontex & Spanish Police Will Oversee Three Spanish Ports to Prevent Smuggling This Summer,23,1,https://www.schengenvisainfo.com/news/frontex-spanish-police-will-oversee-three-spanish-ports-to-prevent-smuggling-this-summer/,https://old.reddit.com/r/europe/comments/oealo3/frontex_spanish_police_will_oversee_three_spanish/
thing_t3_oe7h1h,Galiza,deperrucha,1625491972000,link,nosdiario.gal,O PP tomba unha iniciativa contra a plantación ilegal do eucalipto,31,15,https://www.nosdiario.gal/articulo/politica/pp-tomba-iniciativa-plantacion-ilegal-do-eucalipto/20210624194749124187.html,https://old.reddit.com/r/Galiza/comments/oe7h1h/o_pp_tomba_unha_iniciativa_contra_a_plantación/
