post_id,subreddit,author,timestamp,type,domain,title,score,comments_count,link,comments
thing_t3_qlh4j6,whatsreallygoinon,TrueFreedomForAll,1635895393000,link,archive.md,FBI Sat On Bombshell Footage From Kyle Rittenhouse Shooting,5,1,https://archive.md/rGHSF,https://old.reddit.com/r/whatsreallygoinon/comments/qlh4j6/fbi_sat_on_bombshell_footage_from_kyle/
thing_t3_qlh34r,World_Politics,TrueFreedomForAll,1635895281000,link,archive.md,FBI Sat On Bombshell Footage From Kyle Rittenhouse Shooting,2,0,https://archive.md/rGHSF,https://old.reddit.com/r/World_Politics/comments/qlh34r/fbi_sat_on_bombshell_footage_from_kyle/
thing_t3_qbkus5,CoronavirusCirclejerk,TrueFreedomForAll,1634677236000,link,np.reddit.com,"xpost: FDA To Allow ""Mixing and Matching"" Of COVID Boosters",7,2,https://np.reddit.com/r/World_Politics/comments/qbknur/fda_to_allow_mixing_and_matching_of_covid_boosters/,https://old.reddit.com/r/CoronavirusCirclejerk/comments/qbkus5/xpost_fda_to_allow_mixing_and_matching_of_covid/
thing_t3_qav9ie,CoronavirusCirclejerk,TrueFreedomForAll,1634588739000,link,americanthinker.com,The Unvaccinated Are Looking Smarter Every Week,19,0,https://www.americanthinker.com/articles/2021/10/the_unvaccinated_are_looking_smarter_every_week.html?fbclid=IwAR3vMbxAaHql0uNUL3tBft4YF02ziBpRol4agdBOWz5hEIaotWqlCCh9P_E,https://old.reddit.com/r/CoronavirusCirclejerk/comments/qav9ie/the_unvaccinated_are_looking_smarter_every_week/
thing_t3_qav9zs,whatsreallygoinon,TrueFreedomForAll,1634588777000,link,americanthinker.com,The Unvaccinated Are Looking Smarter Every Week,1,0,https://www.americanthinker.com/articles/2021/10/the_unvaccinated_are_looking_smarter_every_week.html?fbclid=IwAR3vMbxAaHql0uNUL3tBft4YF02ziBpRol4agdBOWz5hEIaotWqlCCh9P_E,https://old.reddit.com/r/whatsreallygoinon/comments/qav9zs/the_unvaccinated_are_looking_smarter_every_week/
thing_t3_qav8ye,DebateVaccines,TrueFreedomForAll,1634588697000,link,americanthinker.com,The Unvaccinated Are Looking Smarter Every Week,1,0,https://www.americanthinker.com/articles/2021/10/the_unvaccinated_are_looking_smarter_every_week.html?fbclid=IwAR3vMbxAaHql0uNUL3tBft4YF02ziBpRol4agdBOWz5hEIaotWqlCCh9P_E,https://old.reddit.com/r/DebateVaccines/comments/qav8ye/the_unvaccinated_are_looking_smarter_every_week/
thing_t3_qav8ai,DebateVaccines,TrueFreedomForAll,1634588646000,link,theexpose.uk,A comparison of official Government reports suggest the Fully Vaccinated are developing Acquired Immunodeficiency Syndrome,2,0,https://theexpose.uk/2021/10/10/comparison-reports-proves-vaccinated-developing-ade/,https://old.reddit.com/r/DebateVaccines/comments/qav8ai/a_comparison_of_official_government_reports/
thing_t3_q69dlh,CoronavirusCirclejerk,TrueFreedomForAll,1633997050000,link,archive.is,"Vioxx: Revisiting Merck's History of Manipulating Science for Profit, Regardless of Public Health Risk",6,1,https://archive.is/hNGAU,https://old.reddit.com/r/CoronavirusCirclejerk/comments/q69dlh/vioxx_revisiting_mercks_history_of_manipulating/
thing_t3_q69el7,EndTheLockdowns,TrueFreedomForAll,1633997139000,link,archive.is,"Vioxx: Revisiting Merck's History of Manipulating Science for Profit, Regardless of Public Health Risk",3,0,https://archive.is/hNGAU,https://old.reddit.com/r/EndTheLockdowns/comments/q69el7/vioxx_revisiting_mercks_history_of_manipulating/
thing_t3_q69e29,whatsreallygoinon,TrueFreedomForAll,1633997092000,link,archive.is,"Vioxx: Revisiting Merck's History of Manipulating Science for Profit, Regardless of Public Health Risk",1,0,https://archive.is/hNGAU,https://old.reddit.com/r/whatsreallygoinon/comments/q69e29/vioxx_revisiting_mercks_history_of_manipulating/
thing_t3_q69csb,World_Politics,TrueFreedomForAll,1633996984000,link,archive.is,"Vioxx: Revisiting Merck's History of Manipulating Science for Profit, Regardless of Public Health Risk",1,0,https://archive.is/hNGAU,https://old.reddit.com/r/World_Politics/comments/q69csb/vioxx_revisiting_mercks_history_of_manipulating/
thing_t3_pxiduv,CoronavirusCirclejerk,TrueFreedomForAll,1632870602000,link,en-volve.com,Canada’s Chief Health Officer ADMITS To FAKING COVID Numbers: ‘We’re Counting ALL Sick People Who Decline COVID Tests As COVID-Positive’,76,6,https://en-volve.com/2021/09/28/canadas-chief-health-officer-admits-to-faking-covid-numbers-were-counting-all-sick-people-who-decline-covid-tests-as-covid-positive/,https://old.reddit.com/r/CoronavirusCirclejerk/comments/pxiduv/canadas_chief_health_officer_admits_to_faking/
thing_t3_pxigma,EndTheLockdowns,TrueFreedomForAll,1632870866000,link,en-volve.com,Canada’s Chief Health Officer ADMITS To FAKING COVID Numbers: ‘We’re Counting ALL Sick People Who Decline COVID Tests As COVID-Positive’,20,1,https://en-volve.com/2021/09/28/canadas-chief-health-officer-admits-to-faking-covid-numbers-were-counting-all-sick-people-who-decline-covid-tests-as-covid-positive/,https://old.reddit.com/r/EndTheLockdowns/comments/pxigma/canadas_chief_health_officer_admits_to_faking/
thing_t3_pxihqm,VaccineNarrative,TrueFreedomForAll,1632870972000,link,en-volve.com,Canada’s Chief Health Officer ADMITS To FAKING COVID Numbers: ‘We’re Counting ALL Sick People Who Decline COVID Tests As COVID-Positive’,3,0,https://en-volve.com/2021/09/28/canadas-chief-health-officer-admits-to-faking-covid-numbers-were-counting-all-sick-people-who-decline-covid-tests-as-covid-positive/,https://old.reddit.com/r/VaccineNarrative/comments/pxihqm/canadas_chief_health_officer_admits_to_faking/
thing_t3_pxid2j,World_Politics,TrueFreedomForAll,1632870533000,link,en-volve.com,Canada’s Chief Health Officer ADMITS To FAKING COVID Numbers: ‘We’re Counting ALL Sick People Who Decline COVID Tests As COVID-Positive’,1,0,https://en-volve.com/2021/09/28/canadas-chief-health-officer-admits-to-faking-covid-numbers-were-counting-all-sick-people-who-decline-covid-tests-as-covid-positive/,https://old.reddit.com/r/World_Politics/comments/pxid2j/canadas_chief_health_officer_admits_to_faking/
thing_t3_pccb9v,CoronavirusCirclejerk,TrueFreedomForAll,1630024390000,link,whatreallyhappened.com,History's 7 Deadly Lessons on “Full FDA Approval”,13,0,https://www.whatreallyhappened.com/?q=node/989492,https://old.reddit.com/r/CoronavirusCirclejerk/comments/pccb9v/historys_7_deadly_lessons_on_full_fda_approval/
thing_t3_pcce9k,DebateVaccines,TrueFreedomForAll,1630024692000,link,whatreallyhappened.com,History's 7 Deadly Lessons on “Full FDA Approval”,3,0,https://www.whatreallyhappened.com/?q=node/989492,https://old.reddit.com/r/DebateVaccines/comments/pcce9k/historys_7_deadly_lessons_on_full_fda_approval/
thing_t3_pccajy,VaccineNarrative,TrueFreedomForAll,1630024314000,link,whatreallyhappened.com,History's 7 Deadly Lessons on “Full FDA Approval”,0,0,https://www.whatreallyhappened.com/?q=node/989492,https://old.reddit.com/r/VaccineNarrative/comments/pccajy/historys_7_deadly_lessons_on_full_fda_approval/
thing_t3_pcc9lh,World_Politics,TrueFreedomForAll,1630024226000,link,whatreallyhappened.com,History's 7 Deadly Lessons on “Full FDA Approval”,1,0,https://www.whatreallyhappened.com/?q=node/989492,https://old.reddit.com/r/World_Politics/comments/pcc9lh/historys_7_deadly_lessons_on_full_fda_approval/
thing_t3_omaika,World_Politics,TrueFreedomForAll,1626548736000,link,archive.is,The Bay of Tweets: Documents Point to US Hand in Cuba Protests,1,0,https://archive.is/CoR4g,https://old.reddit.com/r/World_Politics/comments/omaika/the_bay_of_tweets_documents_point_to_us_hand_in/
thing_t3_nzvfsd,World_Politics,TrueFreedomForAll,1623700612000,text,,"China Blasts G7 Criticisms As Revealing ""Sinister Intentions Of A Few"" Led By US - ""The days when global decisions were dictated by a small group of countries are long gone""",1,0,,https://old.reddit.com/r/World_Politics/comments/nzvfsd/china_blasts_g7_criticisms_as_revealing_sinister/
thing_t3_nl1czb,warcrimes,TrueFreedomForAll,1621980508000,link,archive.is,"Despite ""The Cease Fire"", Israel Intensifies Its Aggression Against Palestinians",9,0,https://archive.is/9sA7M,https://old.reddit.com/r/warcrimes/comments/nl1czb/despite_the_cease_fire_israel_intensifies_its/
thing_t3_nl1c71,israelexposed,TrueFreedomForAll,1621980445000,link,archive.is,"Despite ""The Cease Fire"", Israel Intensifies Its Aggression Against Palestinians",3,0,https://archive.is/9sA7M,https://old.reddit.com/r/israelexposed/comments/nl1c71/despite_the_cease_fire_israel_intensifies_its/
thing_t3_nl1b7p,World_Politics,TrueFreedomForAll,1621980365000,link,archive.is,"Despite ""The Cease Fire"", Israel Intensifies Its Aggression Against Palestinians",2,0,https://archive.is/9sA7M,https://old.reddit.com/r/World_Politics/comments/nl1b7p/despite_the_cease_fire_israel_intensifies_its/
thing_t3_njn2gt,DebateVaccines,TrueFreedomForAll,1621822036000,link,globalcommunityweekly.substack.com,Caught Red-Handed: CDC Changes Test Thresholds To Virtually Eliminate New COVID Cases Among Vaxx'd,68,24,https://globalcommunityweekly.substack.com/p/caught-red-handed-cdc-changes-test,https://old.reddit.com/r/DebateVaccines/comments/njn2gt/caught_redhanded_cdc_changes_test_thresholds_to/
thing_t3_njlkgx,DescentIntoTyranny,TrueFreedomForAll,1621817030000,link,dissidentvoice.org,Total Tyranny: We’ll All Be Targeted under the Government’s New Precrime Program,32,1,https://dissidentvoice.org/2021/05/total-tyranny-well-all-be-targeted-under-the-governments-new-precrime-program/,https://old.reddit.com/r/DescentIntoTyranny/comments/njlkgx/total_tyranny_well_all_be_targeted_under_the/
thing_t3_njll2n,World_Politics,TrueFreedomForAll,1621817085000,link,dissidentvoice.org,Total Tyranny: We’ll All Be Targeted under the Government’s New Precrime Program,2,1,https://dissidentvoice.org/2021/05/total-tyranny-well-all-be-targeted-under-the-governments-new-precrime-program/,https://old.reddit.com/r/World_Politics/comments/njll2n/total_tyranny_well_all_be_targeted_under_the/
thing_t3_njn1ma,World_Politics,TrueFreedomForAll,1621821960000,link,globalcommunityweekly.substack.com,Caught Red-Handed: CDC Changes Test Thresholds To Virtually Eliminate New COVID Cases Among Vaxx'd,0,0,https://globalcommunityweekly.substack.com/p/caught-red-handed-cdc-changes-test,https://old.reddit.com/r/World_Politics/comments/njn1ma/caught_redhanded_cdc_changes_test_thresholds_to/
thing_t3_nfp2m8,EndlessWar,TrueFreedomForAll,1621379009000,link,archive.is,"""Greater Israel"": The Zionist Plan for the Middle East",5,0,https://archive.is/VgSl7,https://old.reddit.com/r/EndlessWar/comments/nfp2m8/greater_israel_the_zionist_plan_for_the_middle/
thing_t3_nfp3yc,israelexposed,TrueFreedomForAll,1621379105000,link,archive.is,"""Greater Israel"": The Zionist Plan for the Middle East",4,0,https://archive.is/VgSl7,https://old.reddit.com/r/israelexposed/comments/nfp3yc/greater_israel_the_zionist_plan_for_the_middle/
thing_t3_nfp0uv,World_Politics,TrueFreedomForAll,1621378882000,link,archive.is,"""Greater Israel"": The Zionist Plan for the Middle East",2,0,https://archive.is/VgSl7,https://old.reddit.com/r/World_Politics/comments/nfp0uv/greater_israel_the_zionist_plan_for_the_middle/
thing_t3_nfqqsb,World_Politics,TrueFreedomForAll,1621383599000,link,archive.is,"America’s Worthless Values - “Everyone, including lesbian, gay, bisexual, transgender, queer, and intersex persons, deserves to live in dignity,” the State Department pontificates. Everyone? How about Palestinians?",1,0,https://archive.is/MD7WM,https://old.reddit.com/r/World_Politics/comments/nfqqsb/americas_worthless_values_everyone_including/
thing_t3_nfole5,World_Politics,TrueFreedomForAll,1621377774000,link,archive.vn,US And Its Allies Try To Split The World In Two,1,0,https://archive.vn/ygSAy,https://old.reddit.com/r/World_Politics/comments/nfole5/us_and_its_allies_try_to_split_the_world_in_two/
thing_t3_n6jytm,World_Politics,TrueFreedomForAll,1620341265000,link,archive.is,Oh What a Lovely New War! False Flagging in the Middle East?,1,0,https://archive.is/DL8jt,https://old.reddit.com/r/World_Politics/comments/n6jytm/oh_what_a_lovely_new_war_false_flagging_in_the/
thing_t3_n0sj47,propaganda,TrueFreedomForAll,1619655244000,link,archive.is,Another Navalny Drama Fizzles Despite Hungry Western Media,1,3,https://archive.is/Hc1OX,https://old.reddit.com/r/propaganda/comments/n0sj47/another_navalny_drama_fizzles_despite_hungry/
thing_t3_n0sifz,World_Politics,TrueFreedomForAll,1619655180000,link,archive.is,Another Navalny Drama Fizzles Despite Hungry Western Media,1,0,https://archive.is/Hc1OX,https://old.reddit.com/r/World_Politics/comments/n0sifz/another_navalny_drama_fizzles_despite_hungry/
thing_t3_myflx2,electionfraud,TrueFreedomForAll,1619379006000,link,web.archive.org,EXACT OPPOSITES: Democrats Illegally Blocked Republican Observers from Entering Vote Counting Areas - Republicans Allow the Whole World to View Maricopa County Audit,0,10,http://web.archive.org/web/20210425192508/https://www.thegatewaypundit.com/2021/04/exact-opposites-democrats-prevent-republicans-entering-vote-counting-area-republicans-allow-whole-world-view/,https://old.reddit.com/r/electionfraud/comments/myflx2/exact_opposites_democrats_illegally_blocked/
thing_t3_myfkvi,World_Politics,TrueFreedomForAll,1619378927000,link,web.archive.org,EXACT OPPOSITES: Democrats Illegally Blocked Republican Observers from Entering Vote Counting Areas - Republicans Allow the Whole World to View Maricopa County Audit,0,0,http://web.archive.org/web/20210425192508/https://www.thegatewaypundit.com/2021/04/exact-opposites-democrats-prevent-republicans-entering-vote-counting-area-republicans-allow-whole-world-view/,https://old.reddit.com/r/World_Politics/comments/myfkvi/exact_opposites_democrats_illegally_blocked/
thing_t3_mvqbux,censorship,TrueFreedomForAll,1619041723000,link,reddit.com,Google is suppressing public health studies they do not agree with (xpost),8,1,https://www.reddit.com/r/World_Politics/comments/mvqb4v/google_is_suppressing_public_health_studies_they/,https://old.reddit.com/r/censorship/comments/mvqbux/google_is_suppressing_public_health_studies_they/
thing_t3_mvqb4v,World_Politics,TrueFreedomForAll,1619041665000,link,investmentwatchblog.com,Google is suppressing public health studies they do not agree with,2,0,https://www.investmentwatchblog.com/google-is-suppressing-public-health-studies-they-do-not-agree-with/,https://old.reddit.com/r/World_Politics/comments/mvqb4v/google_is_suppressing_public_health_studies_they/
thing_t3_muz52n,World_Politics,TrueFreedomForAll,1618949265000,link,lewrockwell.com,UK Nurses Blow Whistle on Crimes Committed in the Name of Covid,1,0,https://www.lewrockwell.com/2021/04/no_author/k-nurses-blow-whistle-on-crimes-committed-in-the-name-of-covid/,https://old.reddit.com/r/World_Politics/comments/muz52n/uk_nurses_blow_whistle_on_crimes_committed_in_the/
thing_t3_mtjx5r,World_Politics,TrueFreedomForAll,1618775101000,link,archive.is,"Big Pharma Conglomerate with a Criminal Record: Pfizer ""Takes Over"" the EU Vaccine Market.",1,0,https://archive.is/H6H1l,https://old.reddit.com/r/World_Politics/comments/mtjx5r/big_pharma_conglomerate_with_a_criminal_record/
thing_t3_mll7xk,World_Politics,TrueFreedomForAll,1617741701000,link,dailytruthreport.com,2+2=5: Oregon Department of Education Pushes Course Claiming Math is Racist Because It Requires a Correct Answer,1,0,https://dailytruthreport.com/225-oregon-department-of-education-pushes-course-claiming-math-is-racist-because-it-requires-a-correct-answer/,https://old.reddit.com/r/World_Politics/comments/mll7xk/225_oregon_department_of_education_pushes_course/
thing_t3_mkrdxn,World_Politics,TrueFreedomForAll,1617647332000,link,archive.is,E.U. Plans for ‘Vaccine Passports’ In Place 20 Months Before Pandemic – Coincidence?,0,0,https://archive.is/2COFX,https://old.reddit.com/r/World_Politics/comments/mkrdxn/eu_plans_for_vaccine_passports_in_place_20_months/
thing_t3_mjgviz,EndlessWar,TrueFreedomForAll,1617482645000,link,archive.is,"US Carrier Launches Operations In East Med As Top US Syria Policy Czar Calls Al-Qaeda Leader ""An Asset""",6,0,https://archive.is/m8W97,https://old.reddit.com/r/EndlessWar/comments/mjgviz/us_carrier_launches_operations_in_east_med_as_top/
thing_t3_mjgur0,World_Politics,TrueFreedomForAll,1617482579000,link,archive.is,"US Carrier Launches Operations In East Med As Top US Syria Policy Czar Calls Al-Qaeda Leader ""An Asset""",1,0,https://archive.is/m8W97,https://old.reddit.com/r/World_Politics/comments/mjgur0/us_carrier_launches_operations_in_east_med_as_top/
thing_t3_lumq4h,World_Politics,TrueFreedomForAll,1614536810000,link,newslocker.com,Is Russia Losing Patience with the EU’s Constant Provocations?,1,0,https://www.newslocker.com/en-us/news/conspiracytheories/is-russia-losing-patience-with-the-eus-constant-provocations/view/,https://old.reddit.com/r/World_Politics/comments/lumq4h/is_russia_losing_patience_with_the_eus_constant/
thing_t3_lqz880,World_Politics,TrueFreedomForAll,1614129225000,link,lifesitenews.com,Frontline Doctor: FBI ‘broke down my door’ in swat team raid of 20 men,2,0,https://www.lifesitenews.com/news/frontline-doctor-fbi-broke-down-my-door-in-swat-team-raid-of-20-men-guns-blazing,https://old.reddit.com/r/World_Politics/comments/lqz880/frontline_doctor_fbi_broke_down_my_door_in_swat/
thing_t3_lh5xu4,World_Politics,TrueFreedomForAll,1612996593000,link,newslocker.com,The Narrative Coup. Real News vs. Fake News,2,0,https://www.newslocker.com/en-us/news/conspiracytheories/the-narrative-coup-real-news-vs-fake-news/view/,https://old.reddit.com/r/World_Politics/comments/lh5xu4/the_narrative_coup_real_news_vs_fake_news/
thing_t3_lclbei,World_Politics,TrueFreedomForAll,1612460726000,link,americanthinker.com,It's time to take seriously teachers' refusal to teach,1,0,https://www.americanthinker.com/blog/2021/02/its_time_to_take_seriously_teachers_refusal_to_teach.html,https://old.reddit.com/r/World_Politics/comments/lclbei/its_time_to_take_seriously_teachers_refusal_to/
thing_t3_l8693u,World_Politics,TrueFreedomForAll,1611959355000,link,thestreet.com,John Kerry's Straw Man Arguments for Wasting Money on Climate Change,1,0,https://www.thestreet.com/mishtalk/economics/john-kerrys-straw-man-arguments-for-wasting-money-on-climate,https://old.reddit.com/r/World_Politics/comments/l8693u/john_kerrys_straw_man_arguments_for_wasting_money/
thing_t3_l6eoll,World_Politics,TrueFreedomForAll,1611782564000,link,static.westernjournal.com,'Hang in there!',1,0,https://static.westernjournal.com/wp-content/uploads/2021/01/Branco-Sinking-Fast.jpg,https://old.reddit.com/r/World_Politics/comments/l6eoll/hang_in_there/
thing_t3_l34buj,World_Politics,TrueFreedomForAll,1611373124000,text,,An Egregious Attack on Free Speech Sends Democrats Cheering!,1,0,,https://old.reddit.com/r/World_Politics/comments/l34buj/an_egregious_attack_on_free_speech_sends/
thing_t3_l2stbs,World_Politics,TrueFreedomForAll,1611337465000,link,lewrockwell.com,"Biden’s America: Us Versus Them? - Joe Biden’s inaugural was the most confusing, contradictory and incoherent ever delivered from the steps of the Capitol, reflective of the mind of its author and the state of the Union he now leads.",0,0,https://www.lewrockwell.com/2021/01/patrick-j-buchanan/bidens-america-one-nation-or-us-versus-them/,https://old.reddit.com/r/World_Politics/comments/l2stbs/bidens_america_us_versus_them_joe_bidens/
thing_t3_l2sotw,World_Politics,TrueFreedomForAll,1611337117000,link,lewrockwell.com,Prepare for Extreme Tyranny; The Likes of Which Have Never Before Been Seen in This Country,0,0,https://www.lewrockwell.com/2021/01/gary-d-barnett/prepare-for-extreme-tyranny-the-likes-of-which-have-never-before-been-seen-in-this-country/,https://old.reddit.com/r/World_Politics/comments/l2sotw/prepare_for_extreme_tyranny_the_likes_of_which/
thing_t3_l1nxmx,World_Politics,TrueFreedomForAll,1611192969000,text,,Why Are Biden’s Top Ten Administrators Dual Citizens?,2,0,,https://old.reddit.com/r/World_Politics/comments/l1nxmx/why_are_bidens_top_ten_administrators_dual/
thing_t3_l098p3,World_Politics,TrueFreedomForAll,1611020668000,link,caitlinjohnstone.com,What ‘Democracy’ Is Under Attack?,1,1,https://caitlinjohnstone.com/2021/01/18/what-democracy-is-under-attack-notes-from-the-edge-of-the-narrative-matrix/,https://old.reddit.com/r/World_Politics/comments/l098p3/what_democracy_is_under_attack/
thing_t3_kyc448,World_Politics,TrueFreedomForAll,1610772030000,link,summit.news,"Peer Reviewed Study Shows COVID Lockdowns Have No Benefits Compared to Voluntary Measures – Stanford researchers found “no clear, significant beneficial effect of [more restrictive measures] on case growth in any country.”",1,0,https://summit.news/2021/01/15/peer-reviewed-study-shows-covid-lockdowns-have-no-benefits-compared-to-voluntary-measures/,https://old.reddit.com/r/World_Politics/comments/kyc448/peer_reviewed_study_shows_covid_lockdowns_have_no/
thing_t3_kybbro,World_Politics,TrueFreedomForAll,1610769047000,link,fromthetrenchesworldreport.com,Confirmed: They Will De-Platform Sites Beyond Their Control Via DNS,0,0,https://fromthetrenchesworldreport.com/confirmed-they-will-de-platform-sites-beyond-their-control-via-dns/280167,https://old.reddit.com/r/World_Politics/comments/kybbro/confirmed_they_will_deplatform_sites_beyond_their/
thing_t3_ky2pih,World_Politics,TrueFreedomForAll,1610741427000,link,patriotrising.com,Totalitarianism Is Upon Us,1,0,https://patriotrising.com/totalitarianism-is-upon-us/,https://old.reddit.com/r/World_Politics/comments/ky2pih/totalitarianism_is_upon_us/
thing_t3_kupg4f,World_Politics,TrueFreedomForAll,1610319882000,link,img-9gag-fun.9cache.com,Health Insurance!!!!!,3,0,https://img-9gag-fun.9cache.com/photo/a9EdqgL_700b.jpg,https://old.reddit.com/r/World_Politics/comments/kupg4f/health_insurance/
thing_t3_ktejz8,World_Politics,TrueFreedomForAll,1610148249000,link,altmediauncensored.com,“Forbidden Weapons” Used Against Gaza Strip Palestinians. Israel Deliberately Targets Palestinian Civilians,1,0,https://altmediauncensored.com/author/dr-zuhair-sabbagh/,https://old.reddit.com/r/World_Politics/comments/ktejz8/forbidden_weapons_used_against_gaza_strip/
thing_t3_ktcms0,World_Politics,TrueFreedomForAll,1610142479000,link,mtracey.medium.com,"Only In Your Imagination Was That An Attempted “Coup” - The idea that this was a real attempt at a “coup”, meaning an attempt to seize by force the reins of the most powerful state in world history, is so preposterous that you really have to be a special kind of deluded in order to believe it.",1,0,https://mtracey.medium.com/only-in-your-imagination-was-that-an-attempted-coup-8bb8cc9fb39b,https://old.reddit.com/r/World_Politics/comments/ktcms0/only_in_your_imagination_was_that_an_attempted/
thing_t3_kstmt2,World_Politics,TrueFreedomForAll,1610074979000,link,allnewspipeline.com,Darkness Falls Upon America And Secrecy Fills The Air As Democrats Attempt To Cement Their Coup,0,0,https://allnewspipeline.com/Covid_19_An_Act_Of_War_Upon_America.php,https://old.reddit.com/r/World_Politics/comments/kstmt2/darkness_falls_upon_america_and_secrecy_fills_the/
thing_t3_kss7nt,World_Politics,TrueFreedomForAll,1610070103000,link,freerepublic.com,"'Moms For America' Call For Americans to Stand Up, Reject Evil and Marxism",0,0,https://freerepublic.com/focus/f-news/3922665/posts,https://old.reddit.com/r/World_Politics/comments/kss7nt/moms_for_america_call_for_americans_to_stand_up/
thing_t3_kr8hy7,World_Politics,TrueFreedomForAll,1609882728000,link,toddstarnes.com,"'Antifa Scumbags' Terrorize Sen. Hawley's Wife And Newborn Daughter After Showing Up To DC House - Washington Post propaganda described the late night protest as a peaceful, candlelight vigil but video shows screaming threats through bullhorns, vandalizing property, pounding on the doors.",0,0,https://www.toddstarnes.com/crime/hawley-blasts-antifa-scumbags-who-terrorized-wife-newborn-daughter-at-familys-home/,https://old.reddit.com/r/World_Politics/comments/kr8hy7/antifa_scumbags_terrorize_sen_hawleys_wife_and/
thing_t3_klxb9z,conspiracy,TrueFreedomForAll,1609184300000,link,spiked-online.com,"Lockdown: a deadly, failed experiment",16,5,https://www.spiked-online.com/2020/12/27/lockdown-a-deadly-failed-experiment/,https://old.reddit.com/r/conspiracy/comments/klxb9z/lockdown_a_deadly_failed_experiment/
thing_t3_klxhky,ConspiracyII,TrueFreedomForAll,1609184857000,link,spiked-online.com,"Lockdown: a deadly, failed experiment",0,1,https://www.spiked-online.com/2020/12/27/lockdown-a-deadly-failed-experiment/,https://old.reddit.com/r/ConspiracyII/comments/klxhky/lockdown_a_deadly_failed_experiment/
thing_t3_kf446t,World_Politics,TrueFreedomForAll,1608232783000,link,pjmedia.com,California Sheriff Refuses 'Absurd' Order to Release Murderers and Rapists Due to Pandemic,0,0,https://pjmedia.com/news-and-politics/rick-moran/2020/12/15/california-sheriff-refuses-absurd-order-to-release-murderers-and-rapists-due-to-pandemic-n1213225,https://old.reddit.com/r/World_Politics/comments/kf446t/california_sheriff_refuses_absurd_order_to/
thing_t3_ke1bfy,World_Politics,TrueFreedomForAll,1608089247000,link,unz.com,Liberal Except for Palestine,1,0,https://www.unz.com/pgiraldi/liberal-except-for-palestine/,https://old.reddit.com/r/World_Politics/comments/ke1bfy/liberal_except_for_palestine/
thing_t3_kd9kcz,World_Politics,TrueFreedomForAll,1607989057000,video,youtube.com,"Israel Commits Terrorist Attack, Ethnic Cleansing, Kills & Arrests Children, All In One Week",0,1,https://www.youtube.com/watch?v=r6XPzSrE5L4&feature=emb_logo,https://old.reddit.com/r/World_Politics/comments/kd9kcz/israel_commits_terrorist_attack_ethnic_cleansing/
